{
  "schemaVersion": 1,
  "taskId": "podcast-3f8a2c71",
  "sequence": 12,
  "revision": 12,
  "type": "worker_completed",
  "snapshot": {
    "id": "podcast-3f8a2c71",
    "kind": "podcast",
    "revision": 12,
    "lastSequence": 12,
    "lifecycleState": "terminal",
    "outcome": "success",
    "requiredAction": "none",
    "progress": {
      "mode": "determinate",
      "percent": 100.0,
      "completedUnits": 42,
      "totalUnits": 42,
      "label": "即将完成",
      "unit": "块",
      "sourceTotalUnits": 42,
      "skippedUnits": 0
    },
    "errorCode": null,
    "errorMessage": null,
    "retryAfterSeconds": null,
    "engineStage": "completed",
    "engineStatus": "exited",
    "recoverable": false,
    "canPause": false,
    "canResume": false,
    "canRetry": false,
    "canCancel": false,
    "bookId": "podcast:fixture-author",
    "sourceId": "fixture-author",
    "displayName": "示例播客第一期",
    "cacheLeaseBytes": 0,
    "createdAt": "2026-07-22T00:00:00Z",
    "updatedAt": "2026-07-22T00:05:00Z",
    "lastHeartbeatAt": "2026-07-22T00:04:58Z",
    "checkpointAt": "2026-07-22T00:04:30Z"
  },
  "createdAt": "2026-07-22T00:05:00Z"
}
